,Abwägungsbereich für die Windenergienutzung,,,,,PR2_RDE_314
,Grundlagendaten Potenzialfläche,,,Grundlagendaten Vorranggebiet,,
,Kreis:,Rendsburg-Eckernförde,,Kreis:,,Rendsburg-Eckernförde
,Stadt/Gemeinde:,"Aukrug, Ehndorf, Wasbek",,Stadt/Gemeinde:,,"Aukrug, Ehndorf, Wasbek"
,Anzahl Teilgebiete:,3,,Anzahl Teilgebiete:,,2
,Größe (ha):,"226,6",,Größe (ha):,,"179,3"
,Realnutzung:,,,Realnutzung:,,
,Die Potenzialfläche besteht aus drei Teilflächen. Die westliche Teilfläche wird,,,,Das Vorranggebiet besteht aus zwei Teilflächen. Die westliche Teilfläche wird,
,überwiegend ackerbaulich genutzt. Die mittlere Fläche besteht zu etwa gleichen,,,,überwiegend ackerbaulich genutzt. Die östliche Fläche besteht zu etwa gleichen,
,"Teilen aus Grünland und Acker, kleine Gehölzflächen sind vorhanden. Weitere",,,,Teilen aus Grünland und Acker. Teils werden die Schläge und Wege von,
,Gehölzflächen wurden ausgespart. Die östliche Teilfläche wird ackerbaulich genutzt.,,,,Wallhecken oder Baumreihen gesäumt. Beide Flächen werden vom Fließgewässer,
,Teils werden Ackergrenzen und Wege von Wallhecken oder Baumreihen gesäumt.,,,Wischbek gequert.,,
,Die westliche sowie die mittlere Teilfläche werden vom Fließgewässer Wischbek,,,,,
,gequert.,,,,,
,Vorbelastung:,,,Vorbelastung:,,
-,,,,-,,
,Sonstige Regionalplandarstellung:,Sonstige Regionalplandarstellung:,,,,
,"Gebiet mit besonderer Bedeutung für Tourismus und Erholung, Stadt- und",,,,Gebiet mit besonderer Bedeutung für Tourismus und Erholung,
,Umlandbereich in ländlichen Räumen,,,,,
,Beschreibung und Bewertung der betroffenen raumordnerischen und umweltfachlichen Abwägungsmerkmale,,,,,
,Überlagerung mit folgenden Kriterien hoher Priorität (vgl. Ziff. 2.8 Plankonzept):,,,,,
,- Potenzielle Beeinträchtigungsbereiche im 750m Radius um Weißstorchhorste/ im 1km Radius um sicher nachgewiesene Standorte von Rotmilanhorsten,,,,,
,Abwägungsentscheidung,,,,,
,,Potenzialfläche wird vollständig als,,Potenzialfläche wird teilweise als,,Potenzialfläche wird nicht als
,?,Vorranggebiet übernommen,?,Vorranggebiet übernommen,?,Vorranggebiet übernommen
,Die Potenzialfläche bleibt gegenüber dem vierten Planentwurf unverändert und wird teilweise als Vorranggebiet übernommen. Zum vierten Entwurf wurden die Waldbereiche,,,,,
,"seitens der zuständigen Fachbehörde überprüft. Dabei wurde festgestellt, dass nicht alle bisher als Wald ausgeschlossenen Bereiche als Wald anzusehen sind. Insofern konnte",,,,,
,das östlich der Hochspannungsfreileitung gelegene Vorranggebiet im nördlichen Teilbereich erweitert werden. Zusätzlich war die Lage der Platzrunden um den Flugplatz Aukrug,,,,,
,"geprüft worden, hier wurde die Potenzialfläche ebenfalls geringfügig angepasst, da der bisherige Ausschlussbereich nicht der veröffentlichten Abgrenzung entsprach. Es ergab",,,,,
,sich eine geringfügige Erweiterung des westlich der Hochspannungsfreileitung gelegenen Vorranggebietes. Die Änderungen bleiben auch nach dem vierten Planentwurf,,,,,
,bestehen.,,,,,
,An der bisherigen Abwägungsentscheidung wird festgehalten: Der als weiches Tabukriterium festgelegte Abstandsbereich um Siedlungen von 800m wird für die Ortslagen der,,,,,
,"Gemeinden Wasbek und Ehndorf um einen 200m erweiterten Schutzbereich ergänzt, da aufgrund der in diesem Bereich fehlenden Windenergienutzung dem Freihalteinteresse",,,,,
,"ein höheres Gewicht eingeräumt wird. Damit entfällt die östliche Teilfläche vollständig, zugleich entfällt dadurch der Überschneidungsbereich mit dem Stadt-Umland-Bereich",,,,,
,"von Neumünster, so dass diesbezüglich kein Konfliktrisiko mehr besteht. Bei der mittleren Teilfläche entfällt ein nordöstlicher Bereich der Potenzialfläche.",,,,,
,Die Potenzialfläche liegt teilweise in einem potenziellen Beeinträchtigungsbereich im engen 1.000m Radius um einen Rotmilanhorst. Zwar kann in Einzelfällen der,,,,,
,"Windenergienutzung in diesen Bereichen ein Vorrang eingeräumt werden, jedoch nur unter der Voraussetzung, dass ein positives artenschutzfachliches Gutachten nach den",,,,,
,Empfehlungen des LLUR / MELUND und abschließendem positiven schriftlichen Votum des LLUR vorliegt. Darüber hinaus muss das Gutachten auf Basis der Teilfortschreibung,,,,,
,2012,vor den OVG-Entscheidungen vom 20. Januar 2015 beauftragt worden sein und die erste Kartierung muss bis spätestens zur Veröffentlichung des Planungserlasses vom,,,,
,23.06.2015 im Amtsblatt begonnen und ohne Unterbrechung weiter durchgeführt worden sein. Da diese Voraussetzungen hier nicht erfüllt sind und zudem eine Ausnahme nach,,,,,
,"§ 45 BNatschG nicht in Aussicht gestellt werden kann, entfällt der Überschneidungsbereich als Vorranggebiet. Der Flächenteil, der im Bereich bis 1.500m um den Rotmilanhorst",,,,,
,"liegt, kann hingegen weiterhin als Vorranggebiet übernommen werden, da auf der Genehmigungsebene Maßnahmen festgesetzt werden können, um ein potenziell signifikant",,,,,
,"erhöhtes Tötungsrisiko zu verringern, so dass auf regionalplanerischer Ebene sichergestellt wird, dass sich der Vorrang der Windenergienutzung auch in den nachfolgenden",,,,,
,Verfahrensebenen durchsetzen kann. Eine Inanspruchnahme dieses Bereiches ist daher möglich. Für die vertiefende Begründung wird auf das Plankonzept verwiesen.,,,,,
,"Der südliche Teil der mittleren Teilfläche wird aufgrund des Denkmalschutzes, hier Archäologie, angepasst. Unmittelbar südlich des Vorranggebietes liegt ein Grabhügel, der",,,,,
,aufgrund seiner Höhe und Lage in der Umgebung landschaftsprägend ist. WKA sind in einem Abstand von 500m denkmalschutzrechtlich nicht genehmigungsfähig. Daher wird,,,,,
,das Vorranggebiet entsprechend dem Radius um den Grabhügel verkleinert. Damit entfällt auch der Überschneidungsbereich mit den Hauptachsen des überregionalen,,,,,
,"Vogelzugs. Die verbleibenden Teilbereiche werden als Vorranggebiet übernommen. Die Belange des Biotopschutzes, hier die die Vorranggebietsflächen querende",,,,,
,"Biotopverbundachse, sind im Rahmen des Genehmigungsverfahrens zu berücksichtigen, stehen jedoch auf Ebene der Raumordnung der Vorranggebietsausweisung nicht",,,,,
,"entgegen. Die Flächen liegen außerhalb von Landschaftsschutzgebieten. Durch den Entfall der Gebiete PR2_RDE_153, PR2_RDE_160 und eines westlichen Teilflächenstücks von",,,,,
,PR2_RDE_314 kommt es zu einer deutlichen Entlastung sowohl des Projektgebietes des Naturschutzrings Aukrug e.V. als auch des Naturparks Aukrug. Damit besteht eine nur,,,,,
,"noch sehr geringe, randliche Überschneidung mit dem Naturpark. Zudem liegt das Vorranggebiet außerhalb der Kernzone. Als Kernzone wird der zentrale Bereich des",,,,,
,Naturparks Aukrug mit dem Boxberg und dem Wiesental der Buckener Au mit dem nördlich hieran angrenzenden Moränenzug angesehen. Diese ist durch das Vorranggebiet,,,,,
,nicht berührt. Zudem sind auch keine Kernbereiche charakteristischer Landschaftsräume betroffen.,,,,,
,Die Potenzialfläche liegt im Wirkbereich der Wetterradarstation des Deutschen Wetterdienstes Boostedt. Diesbezüglich wird auf den entsprechenden Hinweis im Datenblatt,,,,,
,hingewiesen.,,,,,
,PR2_RDE_314,Seite 1 von 3,,,,
